tcpdump -c 5 -i eth0

tcpdump: verbose output suppressed, use -v[v]... for full protocol decode
listening on eth0, link-type EN10MB (Ethernet), snapshot length 262144 bytes
05:50:07.361634 IP lamponubuntu2204-s-1vcpu-1gb-tor1-01.ssh > 162.243.190.66.58173: Flags [P.], seq 2148900078:2148900206, ack 2614261673, win 502, options [nop,nop,TS val 1679396472 ecr 616748649], length 128
05:50:07.361847 IP lamponubuntu2204-s-1vcpu-1gb-tor1-01.ssh > 162.243.190.66.58173: Flags [P.], seq 128:192, ack 1, win 502, options [nop,nop,TS val 1679396473 ecr 616748649], length 64
05:50:07.361906 IP lamponubuntu2204-s-1vcpu-1gb-tor1-01.ssh > 162.243.190.66.58173: Flags [P.], seq 192:272, ack 1, win 502, options [nop,nop,TS val 1679396473 ecr 616748649], length 80
05:50:07.362067 IP lamponubuntu2204-s-1vcpu-1gb-tor1-01.ssh > 162.243.190.66.58173: Flags [P.], seq 272:496, ack 1, win 502, options [nop,nop,TS val 1679396473 ecr 616748649], length 224
05:50:07.362216 IP 162.243.190.66.58173 > lamponubuntu2204-s-1vcpu-1gb-tor1-01.ssh: Flags [.], ack 128, win 1804, options [nop,nop,TS val 616748655 ecr 1679396472], length 0
5 packets captured
34 packets received by filter
0 packets dropped by kernel