tcpdump -n -i eth0

tcpdump: verbose output suppressed, use -v[v]... for full protocol decode
listening on eth0, link-type EN10MB (Ethernet), snapshot length 262144 bytes
06:06:28.942580 IP 146.190.240.68.22 > 162.243.190.66.58173: Flags [P.], seq 2152113422:2152113550, ack 2614263225, win 502, options [nop,nop,TS val 1680378053 ecr 617730233], length 128
06:06:28.942648 IP 146.190.240.68.22 > 162.243.190.66.58173: Flags [P.], seq 128:272, ack 1, win 502, options [nop,nop,TS val 1680378053 ecr 617730233], length 144
06:06:28.942854 IP 146.190.240.68.22 > 162.243.190.66.58173: Flags [P.], seq 272:496, ack 1, win 502, options [nop,nop,TS val 1680378054 ecr 617730233], length 224
06:06:28.943158 IP 162.243.190.66.58173 > 146.190.240.68.22: Flags [.], ack 128, win 1807, options [nop,nop,TS val 617730237 ecr 1680378053], length 0
06:06:28.943218 IP 162.243.190.66.58173 > 146.190.240.68.22: Flags [.], ack 272, win 1807, options [nop,nop,TS val 617730237 ecr 1680378053], length 0
06:06:28.943287 IP 162.243.190.66.58173 > 146.190.240.68.22: Flags [.], ack 496, win 1807, options [nop,nop,TS val 617730237 ecr 1680378054], length 0
06:06:29.043114 IP 146.190.240.68.22 > 162.243.190.66.58173: Flags [P.], seq 496:736, ack 1, win 502, options [nop,nop,TS val 1680378154 ecr 617730237], length 240
06:06:29.043216 IP 146.190.240.68.22 > 162.243.190.66.58173: Flags [P.], seq 736:1024, ack 1, win 502, options [nop,nop,TS val 1680378154 ecr 617730237], length 288
06:06:29.043276 IP 146.190.240.68.22 > 162.243.190.66.58173: Flags [P.], seq 1024:1088, ack 1, win 502, options [nop,nop,TS val 1680378154 ecr 617730237], length 64
06:06:29.043355 IP 146.190.240.68.22 > 162.243.190.66.58173: Flags [P.], seq 1088:1584, ack 1, win 502, options [nop,nop,TS val 1680378154 ecr 617730237], length 496
06:06:29.043453 IP 146.190.240.68.22 > 162.243.190.66.58173: Flags [P.], seq 1584:2192, ack 1, win 502, options [nop,nop,TS val 1680378154 ecr 617730237], length 608
06:06:29.043804 IP 162.243.190.66.58173 > 146.190.240.68.22: Flags [.], ack 736, win 1807, options [nop,nop,TS val 617730337 ecr 1680378154], length 0
06:06:29.043892 IP 162.243.190.66.58173 > 146.190.240.68.22: Flags [.], ack 1024, win 1807, options [nop,nop,TS val 617730337 ecr 1680378154], length 0
06:06:29.043893 IP 162.243.190.66.58173 > 146.190.240.68.22: Flags [.], ack 1088, win 1807, options [nop,nop,TS val 617730337 ecr 1680378154], length 0
06:06:29.043993 IP 162.243.190.66.58173 > 146.190.240.68.22: Flags [.], ack 1584, win 1807, options [nop,nop,TS val 617730337 ecr 1680378154], length 0
06:06:29.043993 IP 162.243.190.66.58173 > 146.190.240.68.22: Flags [.], ack 2192, win 1807, options [nop,nop,TS val 617730338 ecr 1680378154], length 0
06:06:29.147078 IP 146.190.240.68.22 > 162.243.190.66.58173: Flags [P.], seq 2192:2416, ack 1, win 502, options [nop,nop,TS val 1680378258 ecr 617730338], length 224
06:06:29.147156 IP 146.190.240.68.22 > 162.243.190.66.58173: Flags [P.], seq 2416:2704, ack 1, win 502, options [nop,nop,TS val 1680378258 ecr 617730338], length 288
06:06:29.147228 IP 146.190.240.68.22 > 162.243.190.66.58173: Flags [P.], seq 2704:3056, ack 1, win 502, options [nop,nop,TS val 1680378258 ecr 617730338], length 352
06:06:29.147293 IP 146.190.240.68.22 > 162.243.190.66.58173: Flags [P.], seq 3056:3344, ack 1, win 502, options [nop,nop,TS val 1680378258 ecr 617730338], length 288
06:06:29.147371 IP 146.190.240.68.22 > 162.243.190.66.58173: Flags [P.], seq 3344:3632, ack 1, win 502, options [nop,nop,TS val 1680378258 ecr 617730338], length 288
06:06:29.147452 IP 146.190.240.68.22 > 162.243.190.66.58173: Flags [P.], seq 3632:3840, ack 1, win 502, options [nop,nop,TS val 1680378258 ecr 617730338], length 208
06:06:29.147499 IP 146.190.240.68.22 > 162.243.190.66.58173: Flags [P.], seq 3840:4112, ack 1, win 502, options [nop,nop,TS val 1680378258 ecr 617730338], length 272
06:06:29.147562 IP 146.190.240.68.22 > 162.243.190.66.58173: Flags [P.], seq 4112:4384, ack 1, win 502, options [nop,nop,TS val 1680378258 ecr 617730338], length 272
06:06:29.147626 IP 146.190.240.68.22 > 162.243.190.66.58173: Flags [P.], seq 4384:4448, ack 1, win 502, options [nop,nop,TS val 1680378258 ecr 617730338], length 64
06:06:29.147689 IP 146.190.240.68.22 > 162.243.190.66.58173: Flags [P.], seq 4448:4720, ack 1, win 502, options [nop,nop,TS val 1680378258 ecr 617730338], length 272
06:06:29.147702 IP 162.243.190.66.58173 > 146.190.240.68.22: Flags [.], ack 2416, win 1807, options [nop,nop,TS val 617730441 ecr 1680378258], length 0
06:06:29.147834 IP 162.243.190.66.58173 > 146.190.240.68.22: Flags [.], ack 2704, win 1807, options [nop,nop,TS val 617730441 ecr 1680378258], length 0
06:06:29.147834 IP 162.243.190.66.58173 > 146.190.240.68.22: Flags [.], ack 3056, win 1807, options [nop,nop,TS val 617730441 ecr 1680378258], length 0
06:06:29.147852 IP 146.190.240.68.22 > 162.243.190.66.58173: Flags [P.], seq 4720:4992, ack 1, win 502, options [nop,nop,TS val 1680378259 ecr 617730441], length 272
06:06:29.147863 IP 162.243.190.66.58173 > 146.190.240.68.22: Flags [.], ack 3344, win 1807, options [nop,nop,TS val 617730441 ecr 1680378258], length 0
06:06:29.147934 IP 162.243.190.66.58173 > 146.190.240.68.22: Flags [.], ack 3632, win 1807, options [nop,nop,TS val 617730442 ecr 1680378258], length 0
06:06:29.147934 IP 162.243.190.66.58173 > 146.190.240.68.22: Flags [.], ack 3840, win 1807, options [nop,nop,TS val 617730442 ecr 1680378258], length 0
06:06:29.147934 IP 162.243.190.66.58173 > 146.190.240.68.22: Flags [.], ack 4112, win 1807, options [nop,nop,TS val 617730442 ecr 1680378258], length 0
06:06:29.153802 IP 162.243.190.66.58173 > 146.190.240.68.22: Flags [.], ack 4992, win 1807, options [nop,nop,TS val 617730447 ecr 1680378258], length 0
06:06:29.251008 IP 146.190.240.68.22 > 162.243.190.66.58173: Flags [P.], seq 4992:5216, ack 1, win 502, options [nop,nop,TS val 1680378362 ecr 617730447], length 224
06:06:29.251092 IP 146.190.240.68.22 > 162.243.190.66.58173: Flags [P.], seq 5216:5504, ack 1, win 502, options [nop,nop,TS val 1680378362 ecr 617730447], length 288
06:06:29.251175 IP 146.190.240.68.22 > 162.243.190.66.58173: Flags [P.], seq 5504:5856, ack 1, win 502, options [nop,nop,TS val 1680378362 ecr 617730447], length 352
06:06:29.251235 IP 146.190.240.68.22 > 162.243.190.66.58173: Flags [P.], seq 5856:6144, ack 1, win 502, options [nop,nop,TS val 1680378362 ecr 617730447], length 288
06:06:29.251295 IP 146.190.240.68.22 > 162.243.190.66.58173: Flags [P.], seq 6144:6656, ack 1, win 502, options [nop,nop,TS val 1680378362 ecr 617730447], length 512
06:06:29.251357 IP 146.190.240.68.22 > 162.243.190.66.58173: Flags [P.], seq 6656:7008, ack 1, win 502, options [nop,nop,TS val 1680378362 ecr 617730447], length 352
06:06:29.251417 IP 146.190.240.68.22 > 162.243.190.66.58173: Flags [P.], seq 7008:7296, ack 1, win 502, options [nop,nop,TS val 1680378362 ecr 617730447], length 288
06:06:29.251486 IP 146.190.240.68.22 > 162.243.190.66.58173: Flags [P.], seq 7296:7872, ack 1, win 502, options [nop,nop,TS val 1680378362 ecr 617730447], length 576
06:06:29.251565 IP 146.190.240.68.22 > 162.243.190.66.58173: Flags [P.], seq 7872:8352, ack 1, win 502, options [nop,nop,TS val 1680378362 ecr 617730447], length 480
06:06:29.251630 IP 146.190.240.68.22 > 162.243.190.66.58173: Flags [P.], seq 8352:8416, ack 1, win 502, options [nop,nop,TS val 1680378362 ecr 617730447], length 64
06:06:29.251690 IP 146.190.240.68.22 > 162.243.190.66.58173: Flags [P.], seq 8416:8688, ack 1, win 502, options [nop,nop,TS val 1680378362 ecr 617730447], length 272
06:06:29.251752 IP 146.190.240.68.22 > 162.243.190.66.58173: Flags [P.], seq 8688:9184, ack 1, win 502, options [nop,nop,TS val 1680378363 ecr 617730447], length 496
06:06:29.251813 IP 146.190.240.68.22 > 162.243.190.66.58173: Flags [P.], seq 9184:9456, ack 1, win 502, options [nop,nop,TS val 1680378363 ecr 617730447], length 272
06:06:29.251884 IP 146.190.240.68.22 > 162.243.190.66.58173: Flags [P.], seq 9456:9792, ack 1, win 502, options [nop,nop,TS val 1680378363 ecr 617730447], length 336
06:06:29.251914 IP 162.243.190.66.58173 > 146.190.240.68.22: Flags [.], ack 6656, win 1807, options [nop,nop,TS val 617730545 ecr 1680378362], length 0
06:06:29.252026 IP 162.243.190.66.58173 > 146.190.240.68.22: Flags [.], ack 8352, win 1807, options [nop,nop,TS val 617730546 ecr 1680378362], length 0
06:06:29.252041 IP 146.190.240.68.22 > 162.243.190.66.58173: Flags [P.], seq 9792:10336, ack 1, win 502, options [nop,nop,TS val 1680378363 ecr 617730546], length 544
06:06:29.252449 IP 162.243.190.66.58173 > 146.190.240.68.22: Flags [.], ack 10336, win 1807, options [nop,nop,TS val 617730546 ecr 1680378362], length 0
06:06:29.354999 IP 146.190.240.68.22 > 162.243.190.66.58173: Flags [P.], seq 10336:10560, ack 1, win 502, options [nop,nop,TS val 1680378466 ecr 617730546], length 224
06:06:29.355086 IP 146.190.240.68.22 > 162.243.190.66.58173: Flags [P.], seq 10560:10848, ack 1, win 502, options [nop,nop,TS val 1680378466 ecr 617730546], length 288
06:06:29.355150 IP 146.190.240.68.22 > 162.243.190.66.58173: Flags [P.], seq 10848:11136, ack 1, win 502, options [nop,nop,TS val 1680378466 ecr 617730546], length 288
06:06:29.355218 IP 146.190.240.68.22 > 162.243.190.66.58173: Flags [P.], seq 11136:11200, ack 1, win 502, options [nop,nop,TS val 1680378466 ecr 617730546], length 64
06:06:29.355294 IP 146.190.240.68.22 > 162.243.190.66.58173: Flags [P.], seq 11200:11712, ack 1, win 502, options [nop,nop,TS val 1680378466 ecr 617730546], length 512
06:06:29.355362 IP 146.190.240.68.22 > 162.243.190.66.58173: Flags [P.], seq 11712:12000, ack 1, win 502, options [nop,nop,TS val 1680378466 ecr 617730546], length 288
06:06:29.355420 IP 146.190.240.68.22 > 162.243.190.66.58173: Flags [P.], seq 12000:12352, ack 1, win 502, options [nop,nop,TS val 1680378466 ecr 617730546], length 352
06:06:29.355481 IP 146.190.240.68.22 > 162.243.190.66.58173: Flags [P.], seq 12352:12640, ack 1, win 502, options [nop,nop,TS val 1680378466 ecr 617730546], length 288
06:06:29.355549 IP 146.190.240.68.22 > 162.243.190.66.58173: Flags [P.], seq 12640:13152, ack 1, win 502, options [nop,nop,TS val 1680378466 ecr 617730546], length 512
06:06:29.355617 IP 146.190.240.68.22 > 162.243.190.66.58173: Flags [P.], seq 13152:13504, ack 1, win 502, options [nop,nop,TS val 1680378466 ecr 617730546], length 352
06:06:29.355677 IP 146.190.240.68.22 > 162.243.190.66.58173: Flags [P.], seq 13504:13792, ack 1, win 502, options [nop,nop,TS val 1680378466 ecr 617730546], length 288
06:06:29.355741 IP 146.190.240.68.22 > 162.243.190.66.58173: Flags [P.], seq 13792:14368, ack 1, win 502, options [nop,nop,TS val 1680378466 ecr 617730546], length 576
06:06:29.355814 IP 146.190.240.68.22 > 162.243.190.66.58173: Flags [P.], seq 14368:14848, ack 1, win 502, options [nop,nop,TS val 1680378467 ecr 617730546], length 480
06:06:29.355886 IP 146.190.240.68.22 > 162.243.190.66.58173: Flags [P.], seq 14848:15200, ack 1, win 502, options [nop,nop,TS val 1680378467 ecr 617730546], length 352
06:06:29.355964 IP 162.243.190.66.58173 > 146.190.240.68.22: Flags [.], ack 12000, win 1807, options [nop,nop,TS val 617730649 ecr 1680378466], length 0
06:06:29.356005 IP 146.190.240.68.22 > 162.243.190.66.58173: Flags [P.], seq 15200:15472, ack 1, win 502, options [nop,nop,TS val 1680378467 ecr 617730649], length 272
06:06:29.356087 IP 162.243.190.66.58173 > 146.190.240.68.22: Flags [.], ack 13504, win 1807, options [nop,nop,TS val 617730650 ecr 1680378466], length 0
06:06:29.356371 IP 162.243.190.66.58173 > 146.190.240.68.22: Flags [.], ack 15200, win 1807, options [nop,nop,TS val 617730650 ecr 1680378466], length 0
06:06:29.374681 IP 162.243.190.66.58173 > 146.190.240.68.22: Flags [.], ack 15472, win 1807, options [nop,nop,TS val 617730668 ecr 1680378467], length 0
06:06:29.458969 IP 146.190.240.68.22 > 162.243.190.66.58173: Flags [P.], seq 15472:15696, ack 1, win 502, options [nop,nop,TS val 1680378570 ecr 617730668], length 224
06:06:29.459055 IP 146.190.240.68.22 > 162.243.190.66.58173: Flags [P.], seq 15696:15984, ack 1, win 502, options [nop,nop,TS val 1680378570 ecr 617730668], length 288
06:06:29.459152 IP 146.190.240.68.22 > 162.243.190.66.58173: Flags [P.], seq 15984:16336, ack 1, win 502, options [nop,nop,TS val 1680378570 ecr 617730668], length 352
06:06:29.459244 IP 146.190.240.68.22 > 162.243.190.66.58173: Flags [P.], seq 16336:17136, ack 1, win 502, options [nop,nop,TS val 1680378570 ecr 617730668], length 800
06:06:29.459422 IP 146.190.240.68.22 > 162.243.190.66.58173: Flags [P.], seq 17136:18352, ack 1, win 502, options [nop,nop,TS val 1680378570 ecr 617730668], length 1216
06:06:29.459511 IP 146.190.240.68.22 > 162.243.190.66.58173: Flags [P.], seq 18352:18640, ack 1, win 502, options [nop,nop,TS val 1680378570 ecr 617730668], length 288
06:06:29.459595 IP 146.190.240.68.22 > 162.243.190.66.58173: Flags [P.], seq 18640:19216, ack 1, win 502, options [nop,nop,TS val 1680378570 ecr 617730668], length 576
06:06:29.459681 IP 146.190.240.68.22 > 162.243.190.66.58173: Flags [P.], seq 19216:19776, ack 1, win 502, options [nop,nop,TS val 1680378570 ecr 617730668], length 560
06:06:29.460089 IP 146.190.240.68.22 > 162.243.190.66.58173: Flags [P.], seq 19776:20880, ack 1, win 502, options [nop,nop,TS val 1680378571 ecr 617730668], length 1104
06:06:29.460108 IP 162.243.190.66.58173 > 146.190.240.68.22: Flags [.], ack 17136, win 1807, options [nop,nop,TS val 617730753 ecr 1680378570], length 0
06:06:29.460108 IP 162.243.190.66.58173 > 146.190.240.68.22: Flags [.], ack 18640, win 1807, options [nop,nop,TS val 617730754 ecr 1680378570], length 0
06:06:29.461025 IP 162.243.190.66.58173 > 146.190.240.68.22: Flags [.], ack 20880, win 1807, options [nop,nop,TS val 617730754 ecr 1680378570], length 0
06:06:29.563286 IP 146.190.240.68.22 > 162.243.190.66.58173: Flags [P.], seq 20880:21104, ack 1, win 502, options [nop,nop,TS val 1680378674 ecr 617730754], length 224
06:06:29.563395 IP 146.190.240.68.22 > 162.243.190.66.58173: Flags [P.], seq 21104:21392, ack 1, win 502, options [nop,nop,TS val 1680378674 ecr 617730754], length 288
06:06:29.563478 IP 146.190.240.68.22 > 162.243.190.66.58173: Flags [P.], seq 21392:21680, ack 1, win 502, options [nop,nop,TS val 1680378674 ecr 617730754], length 288
06:06:29.563566 IP 146.190.240.68.22 > 162.243.190.66.58173: Flags [P.], seq 21680:22032, ack 1, win 502, options [nop,nop,TS val 1680378674 ecr 617730754], length 352
06:06:29.563658 IP 146.190.240.68.22 > 162.243.190.66.58173: Flags [P.], seq 22032:22320, ack 1, win 502, options [nop,nop,TS val 1680378674 ecr 617730754], length 288
06:06:29.563734 IP 146.190.240.68.22 > 162.243.190.66.58173: Flags [P.], seq 22320:22608, ack 1, win 502, options [nop,nop,TS val 1680378674 ecr 617730754], length 288
06:06:29.563832 IP 146.190.240.68.22 > 162.243.190.66.58173: Flags [P.], seq 22608:23120, ack 1, win 502, options [nop,nop,TS val 1680378675 ecr 617730754], length 512
06:06:29.563901 IP 146.190.240.68.22 > 162.243.190.66.58173: Flags [P.], seq 23120:23408, ack 1, win 502, options [nop,nop,TS val 1680378675 ecr 617730754], length 288
06:06:29.563985 IP 146.190.240.68.22 > 162.243.190.66.58173: Flags [P.], seq 23408:23744, ack 1, win 502, options [nop,nop,TS val 1680378675 ecr 617730754], length 336
06:06:29.564070 IP 146.190.240.68.22 > 162.243.190.66.58173: Flags [P.], seq 23744:24016, ack 1, win 502, options [nop,nop,TS val 1680378675 ecr 617730754], length 272
06:06:29.564308 IP 146.190.240.68.22 > 162.243.190.66.58173: Flags [P.], seq 24016:24288, ack 1, win 502, options [nop,nop,TS val 1680378675 ecr 617730754], length 272
06:06:29.564416 IP 162.243.190.66.58173 > 146.190.240.68.22: Flags [.], ack 22608, win 1807, options [nop,nop,TS val 617730858 ecr 1680378674], length 0
06:06:29.564819 IP 162.243.190.66.58173 > 146.190.240.68.22: Flags [.], ack 24288, win 1807, options [nop,nop,TS val 617730858 ecr 1680378675], length 0
06:06:29.667055 IP 146.190.240.68.22 > 162.243.190.66.58173: Flags [P.], seq 24288:24512, ack 1, win 502, options [nop,nop,TS val 1680378778 ecr 617730858], length 224
06:06:29.667165 IP 146.190.240.68.22 > 162.243.190.66.58173: Flags [P.], seq 24512:24800, ack 1, win 502, options [nop,nop,TS val 1680378778 ecr 617730858], length 288
06:06:29.667253 IP 146.190.240.68.22 > 162.243.190.66.58173: Flags [P.], seq 24800:25088, ack 1, win 502, options [nop,nop,TS val 1680378778 ecr 617730858], length 288
06:06:29.667342 IP 146.190.240.68.22 > 162.243.190.66.58173: Flags [P.], seq 25088:25376, ack 1, win 502, options [nop,nop,TS val 1680378778 ecr 617730858], length 288
06:06:29.667420 IP 146.190.240.68.22 > 162.243.190.66.58173: Flags [P.], seq 25376:25664, ack 1, win 502, options [nop,nop,TS val 1680378778 ecr 617730858], length 288
06:06:29.667501 IP 146.190.240.68.22 > 162.243.190.66.58173: Flags [P.], seq 25664:26016, ack 1, win 502, options [nop,nop,TS val 1680378778 ecr 617730858], length 352
06:06:29.667583 IP 146.190.240.68.22 > 162.243.190.66.58173: Flags [P.], seq 26016:26304, ack 1, win 502, options [nop,nop,TS val 1680378778 ecr 617730858], length 288
06:06:29.667670 IP 146.190.240.68.22 > 162.243.190.66.58173: Flags [P.], seq 26304:26816, ack 1, win 502, options [nop,nop,TS val 1680378778 ecr 617730858], length 512
06:06:29.667748 IP 146.190.240.68.22 > 162.243.190.66.58173: Flags [P.], seq 26816:27168, ack 1, win 502, options [nop,nop,TS val 1680378779 ecr 617730858], length 352
06:06:29.667846 IP 146.190.240.68.22 > 162.243.190.66.58173: Flags [P.], seq 27168:27664, ack 1, win 502, options [nop,nop,TS val 1680378779 ecr 617730858], length 496
06:06:29.667928 IP 146.190.240.68.22 > 162.243.190.66.58173: Flags [P.], seq 27664:28000, ack 1, win 502, options [nop,nop,TS val 1680378779 ecr 617730858], length 336
06:06:29.668345 IP 162.243.190.66.58173 > 146.190.240.68.22: Flags [.], ack 26016, win 1807, options [nop,nop,TS val 617730962 ecr 1680378778], length 0
06:06:29.668346 IP 162.243.190.66.58173 > 146.190.240.68.22: Flags [.], ack 27664, win 1807, options [nop,nop,TS val 617730962 ecr 1680378778], length 0
06:06:29.682175 IP 162.243.190.66.58173 > 146.190.240.68.22: Flags [.], ack 28000, win 1807, options [nop,nop,TS val 617730976 ecr 1680378779], length 0
06:06:29.771014 IP 146.190.240.68.22 > 162.243.190.66.58173: Flags [P.], seq 28000:28224, ack 1, win 502, options [nop,nop,TS val 1680378882 ecr 617730976], length 224
06:06:29.771105 IP 146.190.240.68.22 > 162.243.190.66.58173: Flags [P.], seq 28224:28512, ack 1, win 502, options [nop,nop,TS val 1680378882 ecr 617730976], length 288
06:06:29.771156 IP 146.190.240.68.22 > 162.243.190.66.58173: Flags [P.], seq 28512:28576, ack 1, win 502, options [nop,nop,TS val 1680378882 ecr 617730976], length 64
06:06:29.771218 IP 146.190.240.68.22 > 162.243.190.66.58173: Flags [P.], seq 28576:28864, ack 1, win 502, options [nop,nop,TS val 1680378882 ecr 617730976], length 288
06:06:29.771278 IP 146.190.240.68.22 > 162.243.190.66.58173: Flags [P.], seq 28864:29152, ack 1, win 502, options [nop,nop,TS val 1680378882 ecr 617730976], length 288
06:06:29.771338 IP 146.190.240.68.22 > 162.243.190.66.58173: Flags [P.], seq 29152:29664, ack 1, win 502, options [nop,nop,TS val 1680378882 ecr 617730976], length 512
06:06:29.771400 IP 146.190.240.68.22 > 162.243.190.66.58173: Flags [P.], seq 29664:30016, ack 1, win 502, options [nop,nop,TS val 1680378882 ecr 617730976], length 352
06:06:29.771461 IP 146.190.240.68.22 > 162.243.190.66.58173: Flags [P.], seq 30016:30304, ack 1, win 502, options [nop,nop,TS val 1680378882 ecr 617730976], length 288
06:06:29.771525 IP 146.190.240.68.22 > 162.243.190.66.58173: Flags [P.], seq 30304:30816, ack 1, win 502, options [nop,nop,TS val 1680378882 ecr 617730976], length 512
06:06:29.771589 IP 146.190.240.68.22 > 162.243.190.66.58173: Flags [P.], seq 30816:31168, ack 1, win 502, options [nop,nop,TS val 1680378882 ecr 617730976], length 352
06:06:29.771668 IP 146.190.240.68.22 > 162.243.190.66.58173: Flags [P.], seq 31168:31712, ack 1, win 502, options [nop,nop,TS val 1680378882 ecr 617730976], length 544
06:06:29.771863 IP 146.190.240.68.22 > 162.243.190.66.58173: Flags [P.], seq 31712:31984, ack 1, win 502, options [nop,nop,TS val 1680378883 ecr 617730976], length 272
06:06:29.772596 IP 162.243.190.66.58173 > 146.190.240.68.22: Flags [.], ack 29664, win 1807, options [nop,nop,TS val 617731065 ecr 1680378882], length 0
06:06:29.772650 IP 162.243.190.66.58173 > 146.190.240.68.22: Flags [.], ack 31168, win 1807, options [nop,nop,TS val 617731066 ecr 1680378882], length 0
06:06:29.790811 IP 146.190.240.68.22 > 162.243.190.66.58173: Flags [P.], seq 31712:31984, ack 1, win 502, options [nop,nop,TS val 1680378902 ecr 617731066], length 272
06:06:29.791392 IP 162.243.190.66.58173 > 146.190.240.68.22: Flags [.], ack 31984, win 1807, options [nop,nop,TS val 617731085 ecr 1680378882,nop,nop,sack 1 {31712:31984}], length 0
06:06:29.875042 IP 146.190.240.68.22 > 162.243.190.66.58173: Flags [P.], seq 31984:32208, ack 1, win 502, options [nop,nop,TS val 1680378986 ecr 617731085], length 224
06:06:29.875166 IP 146.190.240.68.22 > 162.243.190.66.58173: Flags [P.], seq 32208:32496, ack 1, win 502, options [nop,nop,TS val 1680378986 ecr 617731085], length 288
06:06:29.875219 IP 146.190.240.68.22 > 162.243.190.66.58173: Flags [P.], seq 32496:32560, ack 1, win 502, options [nop,nop,TS val 1680378986 ecr 617731085], length 64
06:06:29.875284 IP 146.190.240.68.22 > 162.243.190.66.58173: Flags [P.], seq 32560:32848, ack 1, win 502, options [nop,nop,TS val 1680378986 ecr 617731085], length 288
06:06:29.875361 IP 146.190.240.68.22 > 162.243.190.66.58173: Flags [P.], seq 32848:33136, ack 1, win 502, options [nop,nop,TS val 1680378986 ecr 617731085], length 288
06:06:29.875425 IP 146.190.240.68.22 > 162.243.190.66.58173: Flags [P.], seq 33136:33648, ack 1, win 502, options [nop,nop,TS val 1680378986 ecr 617731085], length 512
06:06:29.875489 IP 146.190.240.68.22 > 162.243.190.66.58173: Flags [P.], seq 33648:34000, ack 1, win 502, options [nop,nop,TS val 1680378986 ecr 617731085], length 352
06:06:29.875552 IP 146.190.240.68.22 > 162.243.190.66.58173: Flags [P.], seq 34000:34512, ack 1, win 502, options [nop,nop,TS val 1680378986 ecr 617731085], length 512
06:06:29.875613 IP 146.190.240.68.22 > 162.243.190.66.58173: Flags [P.], seq 34512:34800, ack 1, win 502, options [nop,nop,TS val 1680378986 ecr 617731085], length 288
06:06:29.875682 IP 146.190.240.68.22 > 162.243.190.66.58173: Flags [P.], seq 34800:35376, ack 1, win 502, options [nop,nop,TS val 1680378986 ecr 617731085], length 576
06:06:29.875762 IP 146.190.240.68.22 > 162.243.190.66.58173: Flags [P.], seq 35376:35920, ack 1, win 502, options [nop,nop,TS val 1680378987 ecr 617731085], length 544
06:06:29.875774 IP 162.243.190.66.58173 > 146.190.240.68.22: Flags [.], ack 32208, win 1807, options [nop,nop,TS val 617731169 ecr 1680378986], length 0
06:06:29.875774 IP 162.243.190.66.58173 > 146.190.240.68.22: Flags [.], ack 32496, win 1807, options [nop,nop,TS val 617731169 ecr 1680378986], length 0
06:06:29.875774 IP 162.243.190.66.58173 > 146.190.240.68.22: Flags [.], ack 32560, win 1807, options [nop,nop,TS val 617731169 ecr 1680378986], length 0
06:06:29.875774 IP 162.243.190.66.58173 > 146.190.240.68.22: Flags [.], ack 32848, win 1807, options [nop,nop,TS val 617731169 ecr 1680378986], length 0
06:06:29.875931 IP 162.243.190.66.58173 > 146.190.240.68.22: Flags [.], ack 33136, win 1807, options [nop,nop,TS val 617731169 ecr 1680378986], length 0
06:06:29.875931 IP 162.243.190.66.58173 > 146.190.240.68.22: Flags [.], ack 33648, win 1807, options [nop,nop,TS val 617731169 ecr 1680378986], length 0
06:06:29.875931 IP 162.243.190.66.58173 > 146.190.240.68.22: Flags [.], ack 34000, win 1807, options [nop,nop,TS val 617731170 ecr 1680378986], length 0
06:06:29.875941 IP 146.190.240.68.22 > 162.243.190.66.58173: Flags [P.], seq 35920:36576, ack 1, win 502, options [nop,nop,TS val 1680378987 ecr 617731169], length 656
06:06:29.876034 IP 162.243.190.66.58173 > 146.190.240.68.22: Flags [.], ack 34512, win 1807, options [nop,nop,TS val 617731170 ecr 1680378986], length 0
06:06:29.876063 IP 162.243.190.66.58173 > 146.190.240.68.22: Flags [.], ack 34800, win 1807, options [nop,nop,TS val 617731170 ecr 1680378986], length 0
06:06:29.876135 IP 162.243.190.66.58173 > 146.190.240.68.22: Flags [.], ack 35376, win 1807, options [nop,nop,TS val 617731170 ecr 1680378986], length 0
06:06:29.876220 IP 162.243.190.66.58173 > 146.190.240.68.22: Flags [.], ack 35920, win 1807, options [nop,nop,TS val 617731170 ecr 1680378987], length 0
06:06:29.876304 IP 162.243.190.66.58173 > 146.190.240.68.22: Flags [.], ack 36576, win 1807, options [nop,nop,TS val 617731170 ecr 1680378987], length 0
06:06:29.978972 IP 146.190.240.68.22 > 162.243.190.66.58173: Flags [P.], seq 36576:36800, ack 1, win 502, options [nop,nop,TS val 1680379090 ecr 617731170], length 224
06:06:29.979068 IP 146.190.240.68.22 > 162.243.190.66.58173: Flags [P.], seq 36800:37088, ack 1, win 502, options [nop,nop,TS val 1680379090 ecr 617731170], length 288
06:06:29.979167 IP 146.190.240.68.22 > 162.243.190.66.58173: Flags [P.], seq 37088:37664, ack 1, win 502, options [nop,nop,TS val 1680379090 ecr 617731170], length 576
06:06:29.979262 IP 146.190.240.68.22 > 162.243.190.66.58173: Flags [P.], seq 37664:38240, ack 1, win 502, options [nop,nop,TS val 1680379090 ecr 617731170], length 576
06:06:29.979366 IP 146.190.240.68.22 > 162.243.190.66.58173: Flags [P.], seq 38240:38304, ack 1, win 502, options [nop,nop,TS val 1680379090 ecr 617731170], length 64
06:06:29.979431 IP 146.190.240.68.22 > 162.243.190.66.58173: Flags [P.], seq 38304:38592, ack 1, win 502, options [nop,nop,TS val 1680379090 ecr 617731170], length 288
06:06:29.979506 IP 146.190.240.68.22 > 162.243.190.66.58173: Flags [P.], seq 38592:39104, ack 1, win 502, options [nop,nop,TS val 1680379090 ecr 617731170], length 512
06:06:29.979592 IP 146.190.240.68.22 > 162.243.190.66.58173: Flags [P.], seq 39104:39456, ack 1, win 502, options [nop,nop,TS val 1680379090 ecr 617731170], length 352
06:06:29.979669 IP 146.190.240.68.22 > 162.243.190.66.58173: Flags [P.], seq 39456:39744, ack 1, win 502, options [nop,nop,TS val 1680379090 ecr 617731170], length 288
06:06:29.979682 IP 162.243.190.66.58173 > 146.190.240.68.22: Flags [.], ack 36800, win 1807, options [nop,nop,TS val 617731273 ecr 1680379090], length 0
06:06:29.979682 IP 162.243.190.66.58173 > 146.190.240.68.22: Flags [.], ack 37088, win 1807, options [nop,nop,TS val 617731273 ecr 1680379090], length 0
06:06:29.979682 IP 162.243.190.66.58173 > 146.190.240.68.22: Flags [.], ack 37664, win 1807, options [nop,nop,TS val 617731273 ecr 1680379090], length 0
06:06:29.979711 IP 146.190.240.68.22 > 162.243.190.66.58173: Flags [P.], seq 39744:39952, ack 1, win 502, options [nop,nop,TS val 1680379090 ecr 617731273], length 208
06:06:29.979854 IP 146.190.240.68.22 > 162.243.190.66.58173: Flags [P.], seq 39952:40560, ack 1, win 502, options [nop,nop,TS val 1680379091 ecr 617731273], length 608
06:06:29.979941 IP 146.190.240.68.22 > 162.243.190.66.58173: Flags [P.], seq 40560:41104, ack 1, win 502, options [nop,nop,TS val 1680379091 ecr 617731273], length 544
06:06:29.979974 IP 162.243.190.66.58173 > 146.190.240.68.22: Flags [.], ack 38304, win 1807, options [nop,nop,TS val 617731273 ecr 1680379090], length 0
06:06:29.979975 IP 162.243.190.66.58173 > 146.190.240.68.22: Flags [.], ack 39104, win 1807, options [nop,nop,TS val 617731274 ecr 1680379090], length 0
06:06:29.980107 IP 146.190.240.68.22 > 162.243.190.66.58173: Flags [P.], seq 41104:41648, ack 1, win 502, options [nop,nop,TS val 1680379091 ecr 617731274], length 544
06:06:29.980208 IP 162.243.190.66.58173 > 146.190.240.68.22: Flags [.], ack 39744, win 1807, options [nop,nop,TS val 617731274 ecr 1680379090], length 0
06:06:29.980221 IP 146.190.240.68.22 > 162.243.190.66.58173: Flags [P.], seq 41648:41936, ack 1, win 502, options [nop,nop,TS val 1680379091 ecr 617731274], length 288
06:06:29.980282 IP 146.190.240.68.22 > 162.243.190.66.58173: Flags [P.], seq 41936:42416, ack 1, win 502, options [nop,nop,TS val 1680379091 ecr 617731274], length 480
06:06:29.980326 IP 146.190.240.68.22 > 162.243.190.66.58173: Flags [P.], seq 42416:42480, ack 1, win 502, options [nop,nop,TS val 1680379091 ecr 617731274], length 64
06:06:29.980435 IP 162.243.190.66.58173 > 146.190.240.68.22: Flags [.], ack 40560, win 1807, options [nop,nop,TS val 617731274 ecr 1680379090], length 0
06:06:29.980444 IP 146.190.240.68.22 > 162.243.190.66.58173: Flags [P.], seq 42480:43296, ack 1, win 502, options [nop,nop,TS val 1680379091 ecr 617731274], length 816
06:06:29.980669 IP 162.243.190.66.58173 > 146.190.240.68.22: Flags [.], ack 41648, win 1807, options [nop,nop,TS val 617731274 ecr 1680379091], length 0
06:06:29.980731 IP 162.243.190.66.58173 > 146.190.240.68.22: Flags [.], ack 42416, win 1807, options [nop,nop,TS val 617731274 ecr 1680379091], length 0
06:06:29.980991 IP 162.243.190.66.58173 > 146.190.240.68.22: Flags [.], ack 43296, win 1807, options [nop,nop,TS val 617731275 ecr 1680379091], length 0
06:06:30.083072 IP 146.190.240.68.22 > 162.243.190.66.58173: Flags [P.], seq 43296:43520, ack 1, win 502, options [nop,nop,TS val 1680379194 ecr 617731275], length 224
06:06:30.083192 IP 146.190.240.68.22 > 162.243.190.66.58173: Flags [P.], seq 43520:43808, ack 1, win 502, options [nop,nop,TS val 1680379194 ecr 617731275], length 288
06:06:30.083240 IP 146.190.240.68.22 > 162.243.190.66.58173: Flags [P.], seq 43808:43872, ack 1, win 502, options [nop,nop,TS val 1680379194 ecr 617731275], length 64
06:06:30.083307 IP 146.190.240.68.22 > 162.243.190.66.58173: Flags [P.], seq 43872:44160, ack 1, win 502, options [nop,nop,TS val 1680379194 ecr 617731275], length 288
06:06:30.083387 IP 146.190.240.68.22 > 162.243.190.66.58173: Flags [P.], seq 44160:44672, ack 1, win 502, options [nop,nop,TS val 1680379194 ecr 617731275], length 512
06:06:30.083474 IP 146.190.240.68.22 > 162.243.190.66.58173: Flags [P.], seq 44672:45024, ack 1, win 502, options [nop,nop,TS val 1680379194 ecr 617731275], length 352
06:06:30.083549 IP 146.190.240.68.22 > 162.243.190.66.58173: Flags [P.], seq 45024:45536, ack 1, win 502, options [nop,nop,TS val 1680379194 ecr 617731275], length 512
06:06:30.083619 IP 146.190.240.68.22 > 162.243.190.66.58173: Flags [P.], seq 45536:45600, ack 1, win 502, options [nop,nop,TS val 1680379194 ecr 617731275], length 64
06:06:30.083672 IP 146.190.240.68.22 > 162.243.190.66.58173: Flags [P.], seq 45600:45824, ack 1, win 502, options [nop,nop,TS val 1680379194 ecr 617731275], length 224
06:06:30.083732 IP 146.190.240.68.22 > 162.243.190.66.58173: Flags [P.], seq 45824:46096, ack 1, win 502, options [nop,nop,TS val 1680379194 ecr 617731275], length 272
06:06:30.083811 IP 146.190.240.68.22 > 162.243.190.66.58173: Flags [P.], seq 46096:46640, ack 1, win 502, options [nop,nop,TS val 1680379195 ecr 617731275], length 544
06:06:30.083941 IP 146.190.240.68.22 > 162.243.190.66.58173: Flags [P.], seq 46640:47216, ack 1, win 502, options [nop,nop,TS val 1680379195 ecr 617731275], length 576
06:06:30.084289 IP 146.190.240.68.22 > 162.243.190.66.58173: Flags [P.], seq 47216:49184, ack 1, win 502, options [nop,nop,TS val 1680379195 ecr 617731275], length 1968
06:06:30.084424 IP 146.190.240.68.22 > 162.243.190.66.58173: Flags [P.], seq 49184:49536, ack 1, win 502, options [nop,nop,TS val 1680379195 ecr 617731275], length 352
06:06:30.084443 IP 162.243.190.66.58173 > 146.190.240.68.22: Flags [.], ack 44160, win 1807, options [nop,nop,TS val 617731378 ecr 1680379194], length 0
06:06:30.084443 IP 162.243.190.66.58173 > 146.190.240.68.22: Flags [.], ack 45024, win 1807, options [nop,nop,TS val 617731378 ecr 1680379194], length 0
06:06:30.084443 IP 162.243.190.66.58173 > 146.190.240.68.22: Flags [.], ack 46096, win 1807, options [nop,nop,TS val 617731378 ecr 1680379194], length 0
06:06:30.084674 IP 146.190.240.68.22 > 162.243.190.66.58173: Flags [P.], seq 49536:50096, ack 1, win 502, options [nop,nop,TS val 1680379195 ecr 617731378], length 560
06:06:30.084789 IP 146.190.240.68.22 > 162.243.190.66.58173: Flags [P.], seq 50096:50640, ack 1, win 502, options [nop,nop,TS val 1680379196 ecr 617731378], length 544
06:06:30.084805 IP 162.243.190.66.58173 > 146.190.240.68.22: Flags [.], ack 47216, win 1807, options [nop,nop,TS val 617731378 ecr 1680379195], length 0
06:06:30.084887 IP 146.190.240.68.22 > 162.243.190.66.58173: Flags [P.], seq 50640:50912, ack 1, win 502, options [nop,nop,TS val 1680379196 ecr 617731378], length 272
06:06:30.084903 IP 162.243.190.66.58173 > 146.190.240.68.22: Flags [.], ack 49184, win 1807, options [nop,nop,TS val 617731379 ecr 1680379195], length 0
06:06:30.085212 IP 162.243.190.66.58173 > 146.190.240.68.22: Flags [.], ack 50640, win 1807, options [nop,nop,TS val 617731379 ecr 1680379195], length 0
06:06:30.114303 IP 162.243.190.66.58173 > 146.190.240.68.22: Flags [.], ack 50912, win 1807, options [nop,nop,TS val 617731408 ecr 1680379196], length 0
06:06:30.187012 IP 146.190.240.68.22 > 162.243.190.66.58173: Flags [P.], seq 50912:51136, ack 1, win 502, options [nop,nop,TS val 1680379298 ecr 617731408], length 224
06:06:30.187172 IP 146.190.240.68.22 > 162.243.190.66.58173: Flags [P.], seq 51136:51424, ack 1, win 502, options [nop,nop,TS val 1680379298 ecr 617731408], length 288
06:06:30.187251 IP 146.190.240.68.22 > 162.243.190.66.58173: Flags [P.], seq 51424:51776, ack 1, win 502, options [nop,nop,TS val 1680379298 ecr 617731408], length 352
06:06:30.187293 IP 146.190.240.68.22 > 162.243.190.66.58173: Flags [P.], seq 51776:52000, ack 1, win 502, options [nop,nop,TS val 1680379298 ecr 617731408], length 224
06:06:30.187374 IP 146.190.240.68.22 > 162.243.190.66.58173: Flags [P.], seq 52000:52352, ack 1, win 502, options [nop,nop,TS val 1680379298 ecr 617731408], length 352
06:06:30.187450 IP 146.190.240.68.22 > 162.243.190.66.58173: Flags [P.], seq 52352:52928, ack 1, win 502, options [nop,nop,TS val 1680379298 ecr 617731408], length 576
06:06:30.187525 IP 146.190.240.68.22 > 162.243.190.66.58173: Flags [P.], seq 52928:53440, ack 1, win 502, options [nop,nop,TS val 1680379298 ecr 617731408], length 512
06:06:30.187598 IP 146.190.240.68.22 > 162.243.190.66.58173: Flags [P.], seq 53440:53792, ack 1, win 502, options [nop,nop,TS val 1680379298 ecr 617731408], length 352
06:06:30.187675 IP 146.190.240.68.22 > 162.243.190.66.58173: Flags [P.], seq 53792:54080, ack 1, win 502, options [nop,nop,TS val 1680379298 ecr 617731408], length 288
06:06:30.187759 IP 146.190.240.68.22 > 162.243.190.66.58173: Flags [P.], seq 54080:54304, ack 1, win 502, options [nop,nop,TS val 1680379299 ecr 617731408], length 224
06:06:30.187828 IP 146.190.240.68.22 > 162.243.190.66.58173: Flags [P.], seq 54304:54592, ack 1, win 502, options [nop,nop,TS val 1680379299 ecr 617731408], length 288
06:06:30.187906 IP 146.190.240.68.22 > 162.243.190.66.58173: Flags [P.], seq 54592:54880, ack 1, win 502, options [nop,nop,TS val 1680379299 ecr 617731408], length 288
06:06:30.187977 IP 146.190.240.68.22 > 162.243.190.66.58173: Flags [P.], seq 54880:55088, ack 1, win 502, options [nop,nop,TS val 1680379299 ecr 617731408], length 208
06:06:30.188046 IP 146.190.240.68.22 > 162.243.190.66.58173: Flags [P.], seq 55088:55520, ack 1, win 502, options [nop,nop,TS val 1680379299 ecr 617731408], length 432
06:06:30.188059 IP 162.243.190.66.58173 > 146.190.240.68.22: Flags [.], ack 52928, win 1807, options [nop,nop,TS val 617731482 ecr 1680379298], length 0
06:06:30.188177 IP 146.190.240.68.22 > 162.243.190.66.58173: Flags [P.], seq 55520:55808, ack 1, win 502, options [nop,nop,TS val 1680379299 ecr 617731482], length 288
06:06:30.188260 IP 146.190.240.68.22 > 162.243.190.66.58173: Flags [P.], seq 55808:56096, ack 1, win 502, options [nop,nop,TS val 1680379299 ecr 617731482], length 288
06:06:30.188340 IP 146.190.240.68.22 > 162.243.190.66.58173: Flags [P.], seq 56096:56368, ack 1, win 502, options [nop,nop,TS val 1680379299 ecr 617731482], length 272
06:06:30.188355 IP 162.243.190.66.58173 > 146.190.240.68.22: Flags [.], ack 54592, win 1807, options [nop,nop,TS val 617731482 ecr 1680379298], length 0
06:06:30.188490 IP 146.190.240.68.22 > 162.243.190.66.58173: Flags [P.], seq 56368:57056, ack 1, win 502, options [nop,nop,TS val 1680379299 ecr 617731482], length 688
06:06:30.188689 IP 146.190.240.68.22 > 162.243.190.66.58173: Flags [P.], seq 57056:57120, ack 1, win 502, options [nop,nop,TS val 1680379299 ecr 617731482], length 64
06:06:30.188880 IP 162.243.190.66.58173 > 146.190.240.68.22: Flags [.], ack 56096, win 1807, options [nop,nop,TS val 617731482 ecr 1680379299], length 0
06:06:30.206868 IP 146.190.240.68.22 > 162.243.190.66.58173: Flags [P.], seq 57056:57120, ack 1, win 502, options [nop,nop,TS val 1680379318 ecr 617731482], length 64
06:06:30.207437 IP 162.243.190.66.58173 > 146.190.240.68.22: Flags [.], ack 57120, win 1807, options [nop,nop,TS val 617731501 ecr 1680379299,nop,nop,sack 1 {57056:57120}], length 0
06:06:30.291034 IP 146.190.240.68.22 > 162.243.190.66.58173: Flags [P.], seq 57120:57344, ack 1, win 502, options [nop,nop,TS val 1680379402 ecr 617731501], length 224
06:06:30.291209 IP 146.190.240.68.22 > 162.243.190.66.58173: Flags [P.], seq 57344:58080, ack 1, win 502, options [nop,nop,TS val 1680379402 ecr 617731501], length 736
06:06:30.291324 IP 146.190.240.68.22 > 162.243.190.66.58173: Flags [P.], seq 58080:58816, ack 1, win 502, options [nop,nop,TS val 1680379402 ecr 617731501], length 736
06:06:30.291409 IP 146.190.240.68.22 > 162.243.190.66.58173: Flags [P.], seq 58816:59616, ack 1, win 502, options [nop,nop,TS val 1680379402 ecr 617731501], length 800
06:06:30.291502 IP 146.190.240.68.22 > 162.243.190.66.58173: Flags [P.], seq 59616:60400, ack 1, win 502, options [nop,nop,TS val 1680379402 ecr 617731501], length 784
06:06:30.291607 IP 146.190.240.68.22 > 162.243.190.66.58173: Flags [P.], seq 60400:60896, ack 1, win 502, options [nop,nop,TS val 1680379402 ecr 617731501], length 496
06:06:30.291686 IP 146.190.240.68.22 > 162.243.190.66.58173: Flags [P.], seq 60896:61744, ack 1, win 502, options [nop,nop,TS val 1680379402 ecr 617731501], length 848
06:06:30.291815 IP 146.190.240.68.22 > 162.243.190.66.58173: Flags [P.], seq 61744:61984, ack 1, win 502, options [nop,nop,TS val 1680379403 ecr 617731501], length 240
06:06:30.291925 IP 162.243.190.66.58173 > 146.190.240.68.22: Flags [.], ack 57344, win 1807, options [nop,nop,TS val 617731585 ecr 1680379402], length 0
06:06:30.291986 IP 162.243.190.66.58173 > 146.190.240.68.22: Flags [.], ack 58080, win 1807, options [nop,nop,TS val 617731585 ecr 1680379402], length 0
06:06:30.292103 IP 162.243.190.66.58173 > 146.190.240.68.22: Flags [.], ack 58816, win 1807, options [nop,nop,TS val 617731586 ecr 1680379402], length 0
06:06:30.292103 IP 162.243.190.66.58173 > 146.190.240.68.22: Flags [.], ack 59616, win 1807, options [nop,nop,TS val 617731586 ecr 1680379402], length 0
06:06:30.292275 IP 162.243.190.66.58173 > 146.190.240.68.22: Flags [.], ack 60400, win 1807, options [nop,nop,TS val 617731586 ecr 1680379402], length 0
06:06:30.292275 IP 162.243.190.66.58173 > 146.190.240.68.22: Flags [.], ack 60896, win 1807, options [nop,nop,TS val 617731586 ecr 1680379402], length 0
06:06:30.292361 IP 162.243.190.66.58173 > 146.190.240.68.22: Flags [.], ack 61744, win 1807, options [nop,nop,TS val 617731586 ecr 1680379402], length 0
06:06:30.292361 IP 162.243.190.66.58173 > 146.190.240.68.22: Flags [.], ack 61984, win 1807, options [nop,nop,TS val 617731586 ecr 1680379403], length 0
06:06:30.395003 IP 146.190.240.68.22 > 162.243.190.66.58173: Flags [P.], seq 61984:62208, ack 1, win 502, options [nop,nop,TS val 1680379506 ecr 617731586], length 224
06:06:30.395123 IP 146.190.240.68.22 > 162.243.190.66.58173: Flags [P.], seq 62208:62496, ack 1, win 502, options [nop,nop,TS val 1680379506 ecr 617731586], length 288
06:06:30.395247 IP 146.190.240.68.22 > 162.243.190.66.58173: Flags [P.], seq 62496:63008, ack 1, win 502, options [nop,nop,TS val 1680379506 ecr 617731586], length 512
06:06:30.395345 IP 146.190.240.68.22 > 162.243.190.66.58173: Flags [P.], seq 63008:63568, ack 1, win 502, options [nop,nop,TS val 1680379506 ecr 617731586], length 560
06:06:30.395439 IP 146.190.240.68.22 > 162.243.190.66.58173: Flags [P.], seq 63568:64096, ack 1, win 502, options [nop,nop,TS val 1680379506 ecr 617731586], length 528
06:06:30.395561 IP 146.190.240.68.22 > 162.243.190.66.58173: Flags [P.], seq 64096:64768, ack 1, win 502, options [nop,nop,TS val 1680379506 ecr 617731586], length 672
06:06:30.395698 IP 162.243.190.66.58173 > 146.190.240.68.22: Flags [.], ack 62208, win 1807, options [nop,nop,TS val 617731689 ecr 1680379506], length 0
06:06:30.395698 IP 162.243.190.66.58173 > 146.190.240.68.22: Flags [.], ack 62496, win 1807, options [nop,nop,TS val 617731689 ecr 1680379506], length 0
06:06:30.395730 IP 146.190.240.68.22 > 162.243.190.66.58173: Flags [P.], seq 64768:65136, ack 1, win 502, options [nop,nop,TS val 1680379506 ecr 617731689], length 368
06:06:30.395745 IP 162.243.190.66.58173 > 146.190.240.68.22: Flags [.], ack 63008, win 1807, options [nop,nop,TS val 617731689 ecr 1680379506], length 0
06:06:30.395745 IP 162.243.190.66.58173 > 146.190.240.68.22: Flags [.], ack 63568, win 1807, options [nop,nop,TS val 617731689 ecr 1680379506], length 0
06:06:30.395885 IP 162.243.190.66.58173 > 146.190.240.68.22: Flags [.], ack 64096, win 1807, options [nop,nop,TS val 617731690 ecr 1680379506], length 0
06:06:30.395959 IP 162.243.190.66.58173 > 146.190.240.68.22: Flags [.], ack 64768, win 1807, options [nop,nop,TS val 617731690 ecr 1680379506], length 0
06:06:30.396162 IP 162.243.190.66.58173 > 146.190.240.68.22: Flags [.], ack 65136, win 1807, options [nop,nop,TS val 617731690 ecr 1680379506], length 0
06:06:30.498985 IP 146.190.240.68.22 > 162.243.190.66.58173: Flags [P.], seq 65136:65360, ack 1, win 502, options [nop,nop,TS val 1680379610 ecr 617731690], length 224
06:06:30.499098 IP 146.190.240.68.22 > 162.243.190.66.58173: Flags [P.], seq 65360:65984, ack 1, win 502, options [nop,nop,TS val 1680379610 ecr 617731690], length 624
06:06:30.499202 IP 146.190.240.68.22 > 162.243.190.66.58173: Flags [P.], seq 65984:66912, ack 1, win 502, options [nop,nop,TS val 1680379610 ecr 617731690], length 928
06:06:30.499275 IP 146.190.240.68.22 > 162.243.190.66.58173: Flags [P.], seq 66912:67488, ack 1, win 502, options [nop,nop,TS val 1680379610 ecr 617731690], length 576
06:06:30.499379 IP 146.190.240.68.22 > 162.243.190.66.58173: Flags [P.], seq 67488:67856, ack 1, win 502, options [nop,nop,TS val 1680379610 ecr 617731690], length 368
06:06:30.499921 IP 162.243.190.66.58173 > 146.190.240.68.22: Flags [.], ack 66912, win 1807, options [nop,nop,TS val 617731793 ecr 1680379610], length 0
06:06:30.499983 IP 162.243.190.66.58173 > 146.190.240.68.22: Flags [.], ack 67856, win 1807, options [nop,nop,TS val 617731794 ecr 1680379610], length 0
06:06:30.603023 IP 146.190.240.68.22 > 162.243.190.66.58173: Flags [P.], seq 67856:68080, ack 1, win 502, options [nop,nop,TS val 1680379714 ecr 617731794], length 224
06:06:30.603168 IP 146.190.240.68.22 > 162.243.190.66.58173: Flags [P.], seq 68080:68640, ack 1, win 502, options [nop,nop,TS val 1680379714 ecr 617731794], length 560
06:06:30.603368 IP 146.190.240.68.22 > 162.243.190.66.58173: Flags [P.], seq 68640:69072, ack 1, win 502, options [nop,nop,TS val 1680379714 ecr 617731794], length 432
06:06:30.603462 IP 146.190.240.68.22 > 162.243.190.66.58173: Flags [P.], seq 69072:69344, ack 1, win 502, options [nop,nop,TS val 1680379714 ecr 617731794], length 272
06:06:30.603845 IP 162.243.190.66.58173 > 146.190.240.68.22: Flags [.], ack 69072, win 1807, options [nop,nop,TS val 617731897 ecr 1680379714], length 0
06:06:30.613023 IP 162.243.190.66.58173 > 146.190.240.68.22: Flags [.], ack 69344, win 1807, options [nop,nop,TS val 617731907 ecr 1680379714], length 0
06:06:30.707094 IP 146.190.240.68.22 > 162.243.190.66.58173: Flags [P.], seq 69344:69568, ack 1, win 502, options [nop,nop,TS val 1680379818 ecr 617731907], length 224
06:06:30.707201 IP 146.190.240.68.22 > 162.243.190.66.58173: Flags [P.], seq 69568:69856, ack 1, win 502, options [nop,nop,TS val 1680379818 ecr 617731907], length 288
06:06:30.707273 IP 146.190.240.68.22 > 162.243.190.66.58173: Flags [P.], seq 69856:70144, ack 1, win 502, options [nop,nop,TS val 1680379818 ecr 617731907], length 288
06:06:30.707355 IP 146.190.240.68.22 > 162.243.190.66.58173: Flags [P.], seq 70144:70432, ack 1, win 502, options [nop,nop,TS val 1680379818 ecr 617731907], length 288
06:06:30.707478 IP 146.190.240.68.22 > 162.243.190.66.58173: Flags [P.], seq 70432:70704, ack 1, win 502, options [nop,nop,TS val 1680379818 ecr 617731907], length 272
06:06:30.707571 IP 146.190.240.68.22 > 162.243.190.66.58173: Flags [P.], seq 70704:71040, ack 1, win 502, options [nop,nop,TS val 1680379818 ecr 617731907], length 336
06:06:30.707890 IP 162.243.190.66.58173 > 146.190.240.68.22: Flags [.], ack 70432, win 1807, options [nop,nop,TS val 617732001 ecr 1680379818], length 0
06:06:30.717644 IP 162.243.190.66.58173 > 146.190.240.68.22: Flags [.], ack 71040, win 1807, options [nop,nop,TS val 617732011 ecr 1680379818], length 0
06:06:30.810981 IP 146.190.240.68.22 > 162.243.190.66.58173: Flags [P.], seq 71040:71264, ack 1, win 502, options [nop,nop,TS val 1680379922 ecr 617732011], length 224
06:06:30.811080 IP 146.190.240.68.22 > 162.243.190.66.58173: Flags [P.], seq 71264:72000, ack 1, win 502, options [nop,nop,TS val 1680379922 ecr 617732011], length 736
06:06:30.811215 IP 146.190.240.68.22 > 162.243.190.66.58173: Flags [P.], seq 72000:72592, ack 1, win 502, options [nop,nop,TS val 1680379922 ecr 617732011], length 592
06:06:30.811582 IP 162.243.190.66.58173 > 146.190.240.68.22: Flags [.], ack 72000, win 1807, options [nop,nop,TS val 617732105 ecr 1680379922], length 0
06:06:30.820440 IP 162.243.190.66.58173 > 146.190.240.68.22: Flags [.], ack 72592, win 1807, options [nop,nop,TS val 617732114 ecr 1680379922], length 0
06:06:30.871877 IP 79.124.40.82.50514 > 146.190.240.68.24219: Flags [S], seq 856754040, win 1025, options [mss 1460], length 0
06:06:30.914981 IP 146.190.240.68.22 > 162.243.190.66.58173: Flags [P.], seq 72592:72816, ack 1, win 502, options [nop,nop,TS val 1680380026 ecr 617732114], length 224
06:06:30.915134 IP 146.190.240.68.22 > 162.243.190.66.58173: Flags [P.], seq 72816:73424, ack 1, win 502, options [nop,nop,TS val 1680380026 ecr 617732114], length 608
06:06:30.915260 IP 146.190.240.68.22 > 162.243.190.66.58173: Flags [P.], seq 73424:73760, ack 1, win 502, options [nop,nop,TS val 1680380026 ecr 617732114], length 336
06:06:30.915369 IP 146.190.240.68.22 > 162.243.190.66.58173: Flags [P.], seq 73760:73824, ack 1, win 502, options [nop,nop,TS val 1680380026 ecr 617732114], length 64
06:06:30.916045 IP 162.243.190.66.58173 > 146.190.240.68.22: Flags [.], ack 73760, win 1807, options [nop,nop,TS val 617732209 ecr 1680380026], length 0
06:06:30.924995 IP 162.243.190.66.58173 > 146.190.240.68.22: Flags [.], ack 73824, win 1807, options [nop,nop,TS val 617732219 ecr 1680380026], length 0
06:06:31.019001 IP 146.190.240.68.22 > 162.243.190.66.58173: Flags [P.], seq 73824:74048, ack 1, win 502, options [nop,nop,TS val 1680380130 ecr 617732219], length 224
06:06:31.019081 IP 146.190.240.68.22 > 162.243.190.66.58173: Flags [P.], seq 74048:74336, ack 1, win 502, options [nop,nop,TS val 1680380130 ecr 617732219], length 288
06:06:31.019166 IP 146.190.240.68.22 > 162.243.190.66.58173: Flags [P.], seq 74336:74848, ack 1, win 502, options [nop,nop,TS val 1680380130 ecr 617732219], length 512
06:06:31.019229 IP 146.190.240.68.22 > 162.243.190.66.58173: Flags [P.], seq 74848:75120, ack 1, win 502, options [nop,nop,TS val 1680380130 ecr 617732219], length 272
06:06:31.019292 IP 146.190.240.68.22 > 162.243.190.66.58173: Flags [P.], seq 75120:75392, ack 1, win 502, options [nop,nop,TS val 1680380130 ecr 617732219], length 272
06:06:31.019630 IP 162.243.190.66.58173 > 146.190.240.68.22: Flags [.], ack 74848, win 1807, options [nop,nop,TS val 617732313 ecr 1680380130], length 0
06:06:31.031001 IP 162.243.190.66.58173 > 146.190.240.68.22: Flags [.], ack 75392, win 1807, options [nop,nop,TS val 617732324 ecr 1680380130], length 0
06:06:31.123016 IP 146.190.240.68.22 > 162.243.190.66.58173: Flags [P.], seq 75392:75616, ack 1, win 502, options [nop,nop,TS val 1680380234 ecr 617732324], length 224
06:06:31.123190 IP 146.190.240.68.22 > 162.243.190.66.58173: Flags [P.], seq 75616:76016, ack 1, win 502, options [nop,nop,TS val 1680380234 ecr 617732324], length 400
06:06:31.123293 IP 146.190.240.68.22 > 162.243.190.66.58173: Flags [P.], seq 76016:76720, ack 1, win 502, options [nop,nop,TS val 1680380234 ecr 617732324], length 704
06:06:31.123784 IP 162.243.190.66.58173 > 146.190.240.68.22: Flags [.], ack 76720, win 1807, options [nop,nop,TS val 617732417 ecr 1680380234], length 0
06:06:31.227019 IP 146.190.240.68.22 > 162.243.190.66.58173: Flags [P.], seq 76720:76944, ack 1, win 502, options [nop,nop,TS val 1680380338 ecr 617732417], length 224
06:06:31.227130 IP 146.190.240.68.22 > 162.243.190.66.58173: Flags [P.], seq 76944:77344, ack 1, win 502, options [nop,nop,TS val 1680380338 ecr 617732417], length 400
06:06:31.227349 IP 146.190.240.68.22 > 162.243.190.66.58173: Flags [P.], seq 77344:77552, ack 1, win 502, options [nop,nop,TS val 1680380338 ecr 617732417], length 208
06:06:31.236304 IP 162.243.190.66.58173 > 146.190.240.68.22: Flags [.], ack 77552, win 1807, options [nop,nop,TS val 617732529 ecr 1680380338], length 0
06:06:31.330968 IP 146.190.240.68.22 > 162.243.190.66.58173: Flags [P.], seq 77552:77776, ack 1, win 502, options [nop,nop,TS val 1680380442 ecr 617732529], length 224
06:06:31.331078 IP 146.190.240.68.22 > 162.243.190.66.58173: Flags [P.], seq 77776:78320, ack 1, win 502, options [nop,nop,TS val 1680380442 ecr 617732529], length 544
06:06:31.339317 IP 162.243.190.66.58173 > 146.190.240.68.22: Flags [.], ack 78320, win 1807, options [nop,nop,TS val 617732633 ecr 1680380442], length 0
06:06:31.434998 IP 146.190.240.68.22 > 162.243.190.66.58173: Flags [P.], seq 78320:78544, ack 1, win 502, options [nop,nop,TS val 1680380546 ecr 617732633], length 224
06:06:31.435091 IP 146.190.240.68.22 > 162.243.190.66.58173: Flags [P.], seq 78544:78928, ack 1, win 502, options [nop,nop,TS val 1680380546 ecr 617732633], length 384
06:06:31.441362 IP 162.243.190.66.58173 > 146.190.240.68.22: Flags [.], ack 78928, win 1807, options [nop,nop,TS val 617732735 ecr 1680380546], length 0
06:06:31.539154 IP 146.190.240.68.22 > 162.243.190.66.58173: Flags [P.], seq 78928:79152, ack 1, win 502, options [nop,nop,TS val 1680380650 ecr 617732735], length 224
06:06:31.539280 IP 146.190.240.68.22 > 162.243.190.66.58173: Flags [P.], seq 79152:79536, ack 1, win 502, options [nop,nop,TS val 1680380650 ecr 617732735], length 384
06:06:31.545842 IP 162.243.190.66.58173 > 146.190.240.68.22: Flags [.], ack 79536, win 1807, options [nop,nop,TS val 617732839 ecr 1680380650], length 0
06:06:31.643013 IP 146.190.240.68.22 > 162.243.190.66.58173: Flags [P.], seq 79536:80080, ack 1, win 502, options [nop,nop,TS val 1680380754 ecr 617732839], length 544
06:06:31.643207 IP 146.190.240.68.22 > 162.243.190.66.58173: Flags [P.], seq 80080:80144, ack 1, win 502, options [nop,nop,TS val 1680380754 ecr 617732839], length 64
06:06:31.650450 IP 162.243.190.66.58173 > 146.190.240.68.22: Flags [.], ack 80144, win 1807, options [nop,nop,TS val 617732944 ecr 1680380754], length 0
06:06:31.747041 IP 146.190.240.68.22 > 162.243.190.66.58173: Flags [P.], seq 80144:80544, ack 1, win 502, options [nop,nop,TS val 1680380858 ecr 617732944], length 400
06:06:31.747281 IP 146.190.240.68.22 > 162.243.190.66.58173: Flags [P.], seq 80544:80752, ack 1, win 502, options [nop,nop,TS val 1680380858 ecr 617732944], length 208
06:06:31.753482 IP 162.243.190.66.58173 > 146.190.240.68.22: Flags [.], ack 80752, win 1807, options [nop,nop,TS val 617733047 ecr 1680380858], length 0
06:06:31.851068 IP 146.190.240.68.22 > 162.243.190.66.58173: Flags [P.], seq 80752:81296, ack 1, win 502, options [nop,nop,TS val 1680380962 ecr 617733047], length 544
06:06:31.856528 IP 162.243.190.66.58173 > 146.190.240.68.22: Flags [.], ack 81296, win 1807, options [nop,nop,TS val 617733150 ecr 1680380962], length 0
^C
321 packets captured
326 packets received by filter
0 packets dropped by kernel